{
  "schema_version": 1,
  "audit_id": "a1_ability_coverage_overlap_audit",
  "version": 1,
  "inputs": [
    {
      "path": "data/reviewed/a1-lesson-map.json",
      "sha256": "6e20fd30db58c270e271b45c39c5382db2033dd24368cd14a3d7b2f0bd1e4a56"
    },
    {
      "path": "data/reviewed/a1-reconciliation-worklist-v1.json",
      "sha256": "b61e6d565003c5cee170db8c3660f9b96159894e39f928fe4fd71cd7075ae983"
    },
    {
      "path": "data/reviewed/a1-outcome-level-fit-review-v1.json",
      "sha256": "28c0e4fca70c99f2517314f3b2d866eb8f66a5c5500e7833030b6dc7c74defc4"
    },
    {
      "path": "data/reviewed/communicative-function-strands-v1.json",
      "sha256": "84cef12823195ce803b9f4945406188ac8ad3c20eb0968c3f385dce0605153f2"
    },
    {
      "path": "data/reviewed/level-exit-profiles-v1.json",
      "sha256": "8cd53270688f6aafadddb7beb7f8f3717d832a464f127fefd3def3a1a62da30a"
    },
    {
      "path": "units/unit-01-first-connections/unit-manifest.json",
      "sha256": "2bf5fcb78404dd39aefbbcae31a75f9b2659b9d013ac5cf98fd40365cf259683"
    },
    {
      "path": "units/unit-01-first-connections/unit-mastery.json",
      "sha256": "8f4f81103e91270550337e434c33063b0e0fb562b3065752c6a1d3be22d2fa97"
    }
  ],
  "function_coverage": [
    {
      "function_code": "ask_for_information",
      "candidate_owner_ids": [
        "lesson_candidate.exchange_information_about_an_immediate_need"
      ],
      "support_owner_ids": [],
      "ownership_type": "candidate_owned",
      "coverage_status": "covered"
    },
    {
      "function_code": "clarify_or_repair",
      "candidate_owner_ids": [],
      "support_owner_ids": [
        "support.interaction_repair"
      ],
      "ownership_type": "support_owned",
      "coverage_status": "covered"
    },
    {
      "function_code": "complete_form",
      "candidate_owner_ids": [
        "lesson_candidate.complete_a_simple_information_form",
        "lesson_candidate.complete_a_very_simple_online_purchase_or_application"
      ],
      "support_owner_ids": [],
      "ownership_type": "candidate_owned",
      "coverage_status": "covered"
    },
    {
      "function_code": "comprehend_information",
      "candidate_owner_ids": [
        "lesson_candidate.understand_spoken_personal_introductions",
        "lesson_candidate.understand_spoken_contact_details",
        "lesson_candidate.understand_talk_about_people_and_family",
        "lesson_candidate.understand_a_simple_meeting_arrangement",
        "lesson_candidate.understand_a_short_everyday_activity_text",
        "lesson_candidate.identify_spoken_time_and_date_details",
        "lesson_candidate.understand_talk_about_leisure_preferences_and_abilities",
        "lesson_candidate.match_visual_descriptions_to_familiar_things",
        "lesson_candidate.identify_familiar_referents_from_spoken_clues",
        "lesson_candidate.understand_where_things_or_people_are",
        "lesson_candidate.understand_simple_place_and_hotel_information",
        "lesson_candidate.understand_outline_of_a_simple_guided_tour",
        "lesson_candidate.identify_a_price_in_slow_spoken_service_information",
        "lesson_candidate.follow_a_slow_everyday_service_exchange",
        "lesson_candidate.understand_a_short_simple_postcard_message",
        "lesson_candidate.understand_outline_of_an_illustrated_short_story"
      ],
      "support_owner_ids": [],
      "ownership_type": "candidate_owned",
      "coverage_status": "covered"
    },
    {
      "function_code": "control_language_form",
      "candidate_owner_ids": [],
      "support_owner_ids": [
        "support.basic_language_control",
        "support.written_form_control"
      ],
      "ownership_type": "support_owned",
      "coverage_status": "covered"
    },
    {
      "function_code": "correspond",
      "candidate_owner_ids": [
        "lesson_candidate.write_a_short_message_to_a_friend",
        "lesson_candidate.write_a_short_hobbies_and_likes_post",
        "lesson_candidate.leave_a_simple_whereabouts_and_return_message",
        "lesson_candidate.react_politely_to_a_simple_online_post"
      ],
      "support_owner_ids": [],
      "ownership_type": "candidate_owned",
      "coverage_status": "covered"
    },
    {
      "function_code": "describe",
      "candidate_owner_ids": [
        "lesson_candidate.give_short_self_introduction",
        "lesson_candidate.write_short_personal_profile",
        "lesson_candidate.describe_people_and_object_locations_orally",
        "lesson_candidate.describe_a_family_or_known_person",
        "lesson_candidate.give_a_simple_leisure_profile",
        "lesson_candidate.describe_a_simple_everyday_routine",
        "lesson_candidate.describe_common_weather",
        "lesson_candidate.describe_a_familiar_object_orally",
        "lesson_candidate.write_a_simple_object_description",
        "lesson_candidate.write_a_simple_room_description"
      ],
      "support_owner_ids": [],
      "ownership_type": "candidate_owned",
      "coverage_status": "covered"
    },
    {
      "function_code": "exchange_information",
      "candidate_owner_ids": [
        "lesson_candidate.exchange_personal_details_orally",
        "lesson_candidate.exchange_personal_details_in_writing",
        "lesson_candidate.exchange_information_about_family_and_friends",
        "lesson_candidate.give_an_event_date_and_time",
        "lesson_candidate.exchange_routine_and_preference_information",
        "lesson_candidate.exchange_visible_object_information",
        "lesson_candidate.exchange_basic_information_about_a_home",
        "lesson_candidate.exchange_basic_wayfinding_information",
        "lesson_candidate.exchange_information_about_an_immediate_need",
        "lesson_candidate.handle_basic_price_and_quantity_information",
        "lesson_candidate.describe_a_simple_problem_to_a_health_professional"
      ],
      "support_owner_ids": [],
      "ownership_type": "candidate_owned",
      "coverage_status": "covered"
    },
    {
      "function_code": "express_ability",
      "candidate_owner_ids": [
        "lesson_candidate.give_a_simple_leisure_profile"
      ],
      "support_owner_ids": [],
      "ownership_type": "candidate_owned",
      "coverage_status": "covered"
    },
    {
      "function_code": "express_feeling",
      "candidate_owner_ids": [
        "lesson_candidate.state_how_a_simple_work_made_them_feel"
      ],
      "support_owner_ids": [],
      "ownership_type": "candidate_owned",
      "coverage_status": "covered"
    },
    {
      "function_code": "express_preference",
      "candidate_owner_ids": [
        "lesson_candidate.give_a_simple_leisure_profile",
        "lesson_candidate.exchange_routine_and_preference_information",
        "lesson_candidate.state_a_basic_food_or_drink_preference"
      ],
      "support_owner_ids": [],
      "ownership_type": "candidate_owned",
      "coverage_status": "covered"
    },
    {
      "function_code": "facilitate_interaction",
      "candidate_owner_ids": [
        "lesson_candidate.show_basic_sympathy_during_a_problem_or_disagreement",
        "lesson_candidate.invite_input_and_check_understanding_in_a_simple_task",
        "lesson_candidate.show_interest_and_welcome_an_idea",
        "lesson_candidate.share_an_idea_and_ask_what_others_think"
      ],
      "support_owner_ids": [],
      "ownership_type": "candidate_owned",
      "coverage_status": "covered"
    },
    {
      "function_code": "follow_instructions",
      "candidate_owner_ids": [
        "lesson_candidate.follow_simple_game_or_activity_instructions",
        "lesson_candidate.follow_simple_written_wayfinding_directions",
        "lesson_candidate.follow_slow_spoken_route_directions",
        "lesson_candidate.follow_simple_directions_from_an_interlocutor",
        "lesson_candidate.understand_common_signs_notices_and_visual_instructions",
        "lesson_candidate.follow_short_written_everyday_instructions"
      ],
      "support_owner_ids": [],
      "ownership_type": "candidate_owned",
      "coverage_status": "covered"
    },
    {
      "function_code": "give_information",
      "candidate_owner_ids": [
        "lesson_candidate.give_short_self_introduction",
        "lesson_candidate.write_short_personal_profile",
        "lesson_candidate.describe_people_and_object_locations_orally",
        "lesson_candidate.introduce_another_person",
        "lesson_candidate.exchange_information_about_family_and_friends",
        "lesson_candidate.describe_a_family_or_known_person",
        "lesson_candidate.write_simple_people_profile_cards",
        "lesson_candidate.give_an_event_date_and_time",
        "lesson_candidate.write_a_short_hobbies_and_likes_post",
        "lesson_candidate.write_schedule_dates_and_times",
        "lesson_candidate.write_simple_life_and_routine_sentences",
        "lesson_candidate.describe_a_familiar_object_orally",
        "lesson_candidate.write_a_simple_object_description",
        "lesson_candidate.exchange_information_about_an_immediate_need",
        "lesson_candidate.handle_basic_price_and_quantity_information",
        "lesson_candidate.deliver_a_rehearsed_formal_introduction"
      ],
      "support_owner_ids": [],
      "ownership_type": "candidate_owned",
      "coverage_status": "covered"
    },
    {
      "function_code": "infer_meaning",
      "candidate_owner_ids": [],
      "support_owner_ids": [
        "support.receptive_processing"
      ],
      "ownership_type": "support_owned",
      "coverage_status": "covered"
    },
    {
      "function_code": "introduce",
      "candidate_owner_ids": [
        "lesson_candidate.give_short_self_introduction",
        "lesson_candidate.introduce_another_person",
        "lesson_candidate.respond_politely_to_an_introduction",
        "lesson_candidate.deliver_a_rehearsed_formal_introduction"
      ],
      "support_owner_ids": [],
      "ownership_type": "candidate_owned",
      "coverage_status": "covered"
    },
    {